,id,img,label,text,pred_ps_value
0,8291,./data/img/08291.png,1,white people is this a shooting range,0.7982209
1,46971,./data/img/46971.png,1,bravery at its finest,0.17776097
2,3745,./data/img/03745.png,1,your order comes to $37.50 and your white privilege discount brings the total to $37.50,0.48783457
3,83745,./data/img/83745.png,1,it is time.. to send these parasites back to the desert,0.8387093
4,80243,./data/img/80243.png,1,mississippi wind chime,0.15819444
5,5279,./data/img/05279.png,1,"knowing white people , that's probably the baby father",0.6036322
6,1796,./data/img/01796.png,1,life hack #23 how to get stoned with no weed,0.7588854
7,53046,./data/img/53046.png,1,"you've heard of elf on a shelf, now get ready for",0.48571935
8,82301,./data/img/82301.png,1,cooooooooooooon!!!!,0.27700964
9,31752,./data/img/31752.png,1,when you get to choose your own mental illness,0.5846582
10,27635,./data/img/27635.png,1,dat ass ahmarbkrich*d,0.8607924
11,80597,./data/img/80597.png,1,look! it says it right here! we can fuck goats!,0.9601158
12,45368,./data/img/45368.png,1,enough is enough children are more important than freaks,0.72651726
13,17963,./data/img/17963.png,1,removes polish with chemicals nobody bats an eye removes polish with chemicals everybody loses his shit,0.95791733
14,53968,./data/img/53968.png,1,when you have an 80 point iq but it's the highest in your village,0.15007082
15,10749,./data/img/10749.png,1,my sense of humor is so dark it picks cotton,0.24594192
16,25149,./data/img/25149.png,1,if this offends you you might be lack toes intolerant,0.5707828
17,87520,./data/img/87520.png,1,"yes, we know trump said ""mexico will pay for the wall"" but now mexicans are the wall. that boy good!!!!",0.68008345
18,89071,./data/img/89071.png,1,they don't wash their ass with water and they eat their daughters' ass,0.9584264
19,9563,./data/img/09563.png,1,safe sex isis style,0.69542736
20,72048,./data/img/72048.png,1,hurry up barack will be home soon,0.17367205
21,49826,./data/img/49826.png,1,white people on cinco de mayo vs. every other day,0.67005837
22,26453,./data/img/26453.png,1,"a ww2 jewish prisoner trying to escape the auchschwitz showers (1943, colorized) wwii jew escaping hitler's rath",0.7394154
23,12650,./data/img/12650.png,1,which one has tranny problems?,0.79904044
24,2568,./data/img/02568.png,1,whatsthe difference between heroin and i? cops think twice before shooting heroin,0.7198482
25,83954,./data/img/83954.png,1,head teachers given the power to ban the burqa in british schools share if you want a full ban in britain!,0.53584796
26,24316,./data/img/24316.png,1,sharks don't attack him why? they think it's whale shit,0.95291847
27,62035,./data/img/62035.png,1,thank god my ass needed a break,0.9555147
28,65342,./data/img/65342.png,1,"barn army enlist, and bomb ant hills ""grab your pitchfork and meet at the barn""",0.8361803
29,92058,./data/img/92058.png,1,how black people became christians,0.74840575
30,58672,./data/img/58672.png,1,did you know that the chinese eat dogs savages disgusting,0.80613285
31,54069,./data/img/54069.png,1,when you decide to go full gas,0.40388665
32,91586,./data/img/91586.png,1,left the kitchen too many times,0.16740894
33,87130,./data/img/87130.png,1,finally finding the right tutorial you need indian accent,0.40634808
34,95640,./data/img/95640.png,1,syrian rape survivor speaks out,0.7277155
35,47819,./data/img/47819.png,1,"oh, addiction isn't a disease because it started with a choice?? tell me more about how the chlamydia in your crotch isn't a disease, yet it started with a choice",0.5453469
36,59140,./data/img/59140.png,1,wanna go masturbate? fuck yeah! masturbating!,0.98127174
37,13647,./data/img/13647.png,1,she said girls run the world... so i told her get back in the kitchen,0.31792203
38,65832,./data/img/65832.png,1,why love one but eat the other ? i don't get it,0.123455994
39,57621,./data/img/57621.png,1,if this gets 1k likes i'll post to islam how we see muslims how muslims see us,0.8008965
40,40982,./data/img/40982.png,1,and just like that... this sandwich maker doubles as ironing board,0.19208413
41,43275,./data/img/43275.png,1,my husband is always pushing me around... and talking behind my back,0.2225271
42,12973,./data/img/12973.png,1,someone added to much soap to the dishwasher again,0.19358447
43,74350,./data/img/74350.png,1,a head diaper is required when you have shit for brains,0.92678523
44,2478,./data/img/02478.png,1,must..resist...urge to.. kill whitey.,0.9789684
45,51607,./data/img/51607.png,1,49 people were killed at christchurch muslim 49 people were killed at christchurch mosques muslim,0.8763936
46,65403,./data/img/65403.png,1,money is evil give it to us,0.2587099
47,29750,./data/img/29750.png,1,this cat is getting raped tonight,0.78863615
48,26547,./data/img/26547.png,1,that's the way allah allah i like it,0.34884608
49,2143,./data/img/02143.png,1,"doesnt have food, water, electricity proud of nuclear weapons",0.33750606
50,68192,./data/img/68192.png,1,scientist are working hard to cure them all,0.37623796
51,52603,./data/img/52603.png,1,feeling kinda cute might steal your shit later.. idk,0.942615
52,5349,./data/img/05349.png,0,normal day in a islamic country,0.39819896
53,6491,./data/img/06491.png,1,tranny for sale,0.8921792
54,74013,./data/img/74013.png,1,"nurse: yes sir, we are having mashed potatoes today alzheimer's patient: i don't remember asking you a god damn thing",0.876051
55,27485,./data/img/27485.png,1,thats the way allah allah i like it!!!,0.40946704
56,13026,./data/img/13026.png,1,under the name of multiculturalism we let terrorist into this country,0.50904334
57,17265,./data/img/17265.png,0,meanwhile in baltimore,0.09820186
58,91405,./data/img/91405.png,0,wears rag on her head so her brother husband doesnt want to molest her,0.87765306
59,14026,./data/img/14026.png,1,told girlfriend that mom is deaf so speak loud and slow told mom that girlfriend is retarded,0.8759224
60,18945,./data/img/18945.png,1,when you decide to go full gas,0.403887
61,83920,./data/img/83920.png,1,"just under 17 and a half years ago, 19 people were allowed into the us who should not have been all these years later, we are told that the answer to safety is to allow everyone in",0.084925264
62,83497,./data/img/83497.png,0,different types of radicalization,0.15829271
63,4569,./data/img/04569.png,0,when is the time to eat i am hungry,0.21998094
64,39607,./data/img/39607.png,1,those stupid basterds thought it was a real shower,0.93234444
65,9715,./data/img/09715.png,1,i started a business that sells landmines disguised as prayer mats.. ..prophets are going through the roof,0.07710218
66,1925,./data/img/01925.png,1,i am not racist i just don't like brown sugar,0.4441463
67,94813,./data/img/94813.png,0,thats the way allah allah i like it!!!,0.40946704
68,29437,./data/img/29437.png,1,what can happen if you eat wheaties for 38 years,0.10075174
69,95038,./data/img/95038.png,0,when you take these pics we think about cumming in your mouth,0.948224
70,64891,./data/img/64891.png,1,lebanon: before muslims after muslims but don't worry! after islam takes over there'll be a golden age.. apparently,0.69280386
71,63280,./data/img/63280.png,1,so you're never going to forgive the germans because of the holocaust? same,0.52806973
72,17682,./data/img/17682.png,1,give them what they deserve kill them all,0.9923897
73,84510,./data/img/84510.png,1,bartender: how about a nice 12 yr old? him: boy or girl?,0.28909484
74,28690,./data/img/28690.png,0,if you're gonna talk shit about someone... you better make sure they aren't crazier than you are,0.9346332
75,3567,./data/img/03567.png,1,potato is my favorite color of the alphabet,0.075907946
76,95830,./data/img/95830.png,1,face of terrorism in us,0.39197686
77,29873,./data/img/29873.png,1,who knew that this country is full of white trash,0.92455935
78,70953,./data/img/70953.png,1,"""god's chosen people"" according to the book they wrote",0.14803512
79,56124,./data/img/56124.png,0,how to cook turkey in usa how to cook turkey in romania,0.33062345
80,10386,./data/img/10386.png,1,the book about terrorism,0.29698092
81,19530,./data/img/19530.png,1,they shot the wrong gorilla,0.7670934
82,94185,./data/img/94185.png,1,how a black woman can fight crime,0.8008965
83,48370,./data/img/48370.png,1,72 virgins are ready to get fucked up,0.9519938
84,74058,./data/img/74058.png,0,he made millions of children homeless,0.49891433
85,45062,./data/img/45062.png,0,me and my kids are going to rob this country blind at the expense of the very people that voted for me. and they're going to love it. believe me! bigly!,0.23681346
86,94170,./data/img/94170.png,0,when you decide to go full gas,0.40388665
87,4538,./data/img/04538.png,0,"bows here, bows there, bows everywhere",0.16813822
88,83946,./data/img/83946.png,1,when a white kid shoots up the school the same day you planned to bomb it,0.88719624
89,68127,./data/img/68127.png,0,all you guys think about is dope,0.40770927
90,97453,./data/img/97453.png,0,potato is my favorite color of the alphabet,0.07590801
91,39578,./data/img/39578.png,1,one of the bullets they dug out of a victim from the orland gay night club shooting!,0.8586385
92,49360,./data/img/49360.png,0,who wants ice cream me me me,0.31859422
93,87034,./data/img/87034.png,0,you don't need a parachute to go skydiving twice you need a parachute to go skydiving twice,0.3253849
94,6123,./data/img/06123.png,1,a group of men,0.22549757
95,17028,./data/img/17028.png,1,"feeling bored, let's go to a mosque",0.3908217
96,42903,./data/img/42903.png,0,those stupid basterds thought it was a real shower,0.93234444
97,71680,./data/img/71680.png,1,muslim strip club,0.6951873
98,24135,./data/img/24135.png,0,good night keep your butthole tight,0.8824188
99,32875,./data/img/32875.png,0,if he wears number one he's most likely the fastes on the team,0.10118626
100,79085,./data/img/79085.png,1,today we are making vegetable soup,0.07250042
101,61872,./data/img/61872.png,1,don't be a fool it is a bomb,0.80609417
102,30579,./data/img/30579.png,0,white power!,0.58178014
103,62504,./data/img/62504.png,0,we've taken this country! now fuck off! we're taking it back!,0.960651
104,43810,./data/img/43810.png,1,how to cook turkey in usa how to cook turkey in romania,0.33062345
105,19730,./data/img/19730.png,1,jamal is practicing for class sport,0.14859536
106,37420,./data/img/37420.png,0,like lebanon terrorism can destroy a beautiful country,0.7832116
107,82509,./data/img/82509.png,0,72 virgins are ready to get fucked up,0.9519938
108,96284,./data/img/96284.png,1,welcome to melbourne,0.111112624
109,97068,./data/img/97068.png,1,these hitler jokes are rude anne frankly i don't care,0.56054246
110,3214,./data/img/03214.png,0,bartender: how about a nice 12 yr old? him: boy or girl?,0.28909484
111,23810,./data/img/23810.png,1,these aren't people,0.4451256
112,91836,./data/img/91836.png,1,one of my 5 boyfriends slept with another girl i'll never trust men again!,0.6269589
113,5126,./data/img/05126.png,1,can you smell what the reich is cooking,0.5154597
114,76092,./data/img/76092.png,0,everybody is afraid of gangs,0.25733557
115,64072,./data/img/64072.png,1,trump said immigrants come here to steal your wife is a great example she stole my speech,0.7930652
116,91058,./data/img/91058.png,0,get in loser we're invading poland,0.734651
117,21643,./data/img/21643.png,0,haha pig man is peeing standing up,0.8824589
118,19523,./data/img/19523.png,0,they see them rollin.... they hating..,0.4222035
119,32691,./data/img/32691.png,1,this is how muslims celebrate new year,0.58523935
120,87169,./data/img/87169.png,1,albanians talking photo with a porn star,0.77345425
121,92738,./data/img/92738.png,1,"they are the best in basketball because they can steal, shoot and run",0.8908898
122,53027,./data/img/53027.png,0,putting bows on your pet,0.4986752
123,27195,./data/img/27195.png,0,there's a reason we keep the beer in the bottom of the cooler,0.13818921
124,43910,./data/img/43910.png,0,i just started a company selling landmines that look like prayer mats prophets are going through the roof,0.08425468
125,5213,./data/img/05213.png,0,the families of the hillsborough tragedy were denied legal aid.... but shamima begum gets it to fight for her uk citizenship our system is a sick joke! - martin costello,0.3222957
126,73945,./data/img/73945.png,0,jamal is holding a gun,0.55803096
127,56207,./data/img/56207.png,1,we broke up but she said we could still be cousins,0.24986613
128,68459,./data/img/68459.png,1,family trip in mexico,0.15363245
129,63175,./data/img/63175.png,0,"if i was uncircumcised i'd hide candy in my dick skin so when a girl about to suck me up, she has a pleasant surprise.. oh my god, skittles",0.93690646
130,82945,./data/img/82945.png,0,be careful who you call ugly in highschool,0.734651
131,34975,./data/img/34975.png,0,what if the only reason mary got pregnant... is because god is gay and needed a surrogate,0.9140726
132,61973,./data/img/61973.png,1,what do alcoholics and necrophiliacs have in common they both love to crack open a cold one.,0.5663815
133,16420,./data/img/16420.png,0,abnormal vs normal,0.3092511
134,73069,./data/img/73069.png,1,immigration invasion learn the difference,0.4072057
135,47056,./data/img/47056.png,1,illegal aliens are not welcome,0.8624896
136,56428,./data/img/56428.png,0,if the shocker don't rock her spock her,0.32303426
137,54206,./data/img/54206.png,0,you can smell disgust and hate from this photo,0.69870025
138,93172,./data/img/93172.png,0,this is a terrorist,0.55268604
139,56980,./data/img/56980.png,0,coffee isn't helping get the jumper cables,0.08181029
140,79615,./data/img/79615.png,0,what women think men want what men really want,0.55974424
141,38047,./data/img/38047.png,0,"""stupid bitch"" is not a race",0.96887034
142,94560,./data/img/94560.png,1,and for my next class project!,0.06691644
143,96250,./data/img/96250.png,0,i'm going home i'm russian,0.23664305
144,28951,./data/img/28951.png,0,if the brim of your hat is flat and has a sticker on it i automatically assume you're a complete tool,0.47009316
145,27614,./data/img/27614.png,0,maybe if you think before you act you'd be treated better,0.216408
146,4857,./data/img/04857.png,1,...even the dumb jews know that! trump is a racist.,0.93740404
147,79603,./data/img/79603.png,1,its friday cunts lets get on the gas,0.92518306
148,26985,./data/img/26985.png,1,i just heard my girlfriend is pregnant,0.110202976
149,14873,./data/img/14873.png,1,human dna found in ancient goat carcass scientists believe this is first proof muhammad existed,0.6194064
150,54893,./data/img/54893.png,0,"old people at weddings always poke me and say ""you're next."" so, i started doing the same thing to them at funerals",0.5058048
151,48236,./data/img/48236.png,0,that blood you donated could be in someone's boner right now,0.71130174
152,74908,./data/img/74908.png,0,she is condemning shooting the gorilla,0.8763936
153,96472,./data/img/96472.png,1,white power!,0.58178014
154,89430,./data/img/89430.png,0,when you know you don't have to jackoff tonight,0.18358465
155,76921,./data/img/76921.png,1,she probably asked a wrong question,0.11703839
156,68409,./data/img/68409.png,1,for the last time im not michelle obama,0.27789444
157,16354,./data/img/16354.png,1,we've taken this country! now fuck off! we're taking it back!,0.960651
158,69548,./data/img/69548.png,1,"wait, mohammad come back i didn't mean to laugh, really size dosen't matter to me lol",0.14831218
159,1456,./data/img/01456.png,1,they see them rollin..... they hating..,0.41946998
160,17950,./data/img/17950.png,0,"i was excoriated for a harmless ""tweet"" and ""my show"" was cancelled",0.12166431
161,76295,./data/img/76295.png,0,islamic extremist planning new project,0.6775642
162,42580,./data/img/42580.png,1,jack and jill went up the hill so jack could lick her candy but jack got a shock and a mouthful of cock cause jills real name was randy,0.8334737
163,96180,./data/img/96180.png,1,putting bows on your pet,0.49867526
164,98701,./data/img/98701.png,1,oh no i can't steal anymore,0.18924715
165,15243,./data/img/15243.png,0,4 am. everyone is asleep perfect time to run from one end of the house to the other at full speed as loudly as possible,0.24197944
166,41058,./data/img/41058.png,0,john wilkes booth be like: yall sure abraham lincoln dead? he aint up here,0.61977744
167,62375,./data/img/62375.png,1,im not saying i'm racist im just saying all muslims are terrorists,0.904605
168,63507,./data/img/63507.png,0,evolution from peeling bananas to busting caps,0.0715778
169,31208,./data/img/31208.png,1,maybe if we weren't consistent sources of crime we'd be treated better,0.19626002
170,62319,./data/img/62319.png,1,"america in 2045 ""grandpa...why didn't you stop them?!""",0.24336006
171,68253,./data/img/68253.png,1,free blanket maybe white man not so bad after all,0.7607775
172,34687,./data/img/34687.png,1,everyone is afraid of dark,0.17684467
173,34209,./data/img/34209.png,0,how about a nice 12 yr old? bartender: him: boy i would love that,0.2568507
174,39827,./data/img/39827.png,1,kick them out of country,0.9570354
175,46920,./data/img/46920.png,1,we want sharia law !! well.... go home,0.269602
176,84273,./data/img/84273.png,0,when you're the reason for the company safety video,0.22787677
177,39018,./data/img/39018.png,0,"she said ""i want a ring"" i said ""bitch take your phone off silent!""",0.92678523
178,54780,./data/img/54780.png,1,travel size coffee maker,0.17418177
179,69150,./data/img/69150.png,1,"""white privilege the privilege of being called ""racist"" by other people who see nothing else about you except the color of your skin",0.73210406
180,29843,./data/img/29843.png,0,the world's most wanted terrorist obama bin lying,0.6635964
181,19385,./data/img/19385.png,0,rose's are red violet's are blue little stupid ass bitch i ain't fuckin witchu,0.9790995
182,64510,./data/img/64510.png,0,mohammad won the contest in putting underwear on goats,0.5577153
183,47103,./data/img/47103.png,0,maybe we weren't consistent sources of crime we'd be treated better,0.17141868
184,61038,./data/img/61038.png,0,no wonder why the pipes are not working,0.11227864
185,71620,./data/img/71620.png,1,we are returning our broken coffee maker,0.13060609
186,91602,./data/img/91602.png,0,upper downer,0.08118173
187,30145,./data/img/30145.png,0,"before my presidency, there was no isis. there was no caliphate there was no blm. there was no antifa. there was no war on police i built that",0.5200802
188,91756,./data/img/91756.png,1,abnormal vs normal,0.30925125
189,63745,./data/img/63745.png,1,we could destroy all of them but we let some of them survive so you know why we did it,0.8763936
190,47162,./data/img/47162.png,1,what do these two have in common? they both are good at sucking they both come with a bag,0.77926546
191,59806,./data/img/59806.png,0,"on tuesday, november 3, 2020, we make america great again  by voting this nightmare out of office!",0.14840604
192,7135,./data/img/07135.png,1,this is the greatest news manufacturing in 20th century,0.07657124
193,35497,./data/img/35497.png,0,"old people at weddings always poke me and say ""you're next."" so, i started doing the same thing to them at funerals",0.5058048
194,84362,./data/img/84362.png,0,unleash the inner beast on the field,0.380613
195,84015,./data/img/84015.png,1,my irony meter just exploded,0.55482185
196,87251,./data/img/87251.png,0,i love apes they are both ugly and cute,0.7527626
197,82590,./data/img/82590.png,1,burning them was a great public service,0.9570354
198,59738,./data/img/59738.png,1,what's the difference between a refugee and e.t e.t learned english and wanted to go home,0.32303414
199,35470,./data/img/35470.png,0,can you smell what the reigh is cooking,0.31465423
200,72061,./data/img/72061.png,1,i like my rice crispy please,0.14234987
201,3524,./data/img/03524.png,1,terrorist can come to this country way to easy,0.4582402
202,86170,./data/img/86170.png,1,how to keep the thefts out,0.24997766
203,50841,./data/img/50841.png,0,give them what they deserve kill them all,0.9923897
204,46087,./data/img/46087.png,0,give that man a suicide,0.88572806
205,42058,./data/img/42058.png,0,for lunch vlad the impaler loved turkey,0.2523389
206,1967,./data/img/01967.png,0,when you decide to stop racism by burning its symbol,0.761067
207,54930,./data/img/54930.png,1,not all muslims are isis! some are al-qaida the rest are taliban,0.8451872
208,38076,./data/img/38076.png,1,"""he's a squirter"" doesn't sound as sexy when you are gay",0.9047837
209,38910,./data/img/38910.png,1,oh boy i sure love being muslim in the new zealand city of christchurch on march 15,0.5662183
210,6723,./data/img/06723.png,1,the hardest part to eat in a vegetable,0.17910561
211,2157,./data/img/02157.png,1,"mohammed i'm pregnant.... don't sass me, you know it's funny! ~cupcakes",0.17703795
212,62948,./data/img/62948.png,1,"black lives matter >""how"",""why""and ""to whom"" is unclear",0.8000647
213,21075,./data/img/21075.png,0,size of a shuttle bus legroom of a pinto,0.24209155
214,73601,./data/img/73601.png,1,when you are white and stole your first bike,0.80613256
215,32579,./data/img/32579.png,0,come to the dark side we have weed,0.40316615
216,21567,./data/img/21567.png,1,our dad is a potato farmer,0.48176464
217,1765,./data/img/01765.png,1,"after a girl dies, what organ in her body stays warm? my dick",0.9332088
218,53172,./data/img/53172.png,0,straight outta the oven step one :turn on the gas,0.6181539
219,32568,./data/img/32568.png,1,america taught us how to be happy slaves the same way school teach us how to be happy employees,0.41625527
220,1742,./data/img/01742.png,0,in just one hour from now i'll only have 4 hours left until i have to work a mere 3 hours,0.25707
221,56098,./data/img/56098.png,1,"i said ""a glass of juice"".",0.13247015
222,78612,./data/img/78612.png,0,go see fifty shades darker in theaters alone and throw mayonnaise at couples in the dark,0.21860705
223,34018,./data/img/34018.png,1,fuck the catholics fuck the catholic church fuck the pope,0.9834532
224,53609,./data/img/53609.png,0,"when your friend insists on paying for dinner but you still want to contribute - just the tip, come on... let me",0.08189799
225,89362,./data/img/89362.png,1,has extra chromosome probably stole it,0.27501923
226,80426,./data/img/80426.png,1,a talking ape,0.53461736
227,83045,./data/img/83045.png,1,"so much trash, we need a garbage collector",0.72658896
228,61503,./data/img/61503.png,0,someone else used kids to push an agenda,0.2585472
229,41890,./data/img/41890.png,1,house of pedophile,0.6551375
230,52091,./data/img/52091.png,1,"women ask for equal rights, so i give them equal lefts aswell",0.34269583
231,24396,./data/img/24396.png,1,"so like, why are men even gay? girls have buttholes too you know.",0.8503078
232,72168,./data/img/72168.png,1,upper downer,0.08118103
233,85761,./data/img/85761.png,1,no wonder why the pipes are not working,0.11227864
234,35719,./data/img/35719.png,0,jamal is practicing for class sport,0.14859536
235,90256,./data/img/90256.png,1,"whenever you feel stupid, remember there are people who throw stones at a wall! aiming for an invisible devil, told by an invisible god for an invisible heaven!",0.80613285
236,20984,./data/img/20984.png,0,when you are white and stole your first bike,0.80613256
237,95086,./data/img/95086.png,1,novaky concentration camp these jews can claim holocaust pensions,0.75456667
238,49028,./data/img/49028.png,0,i finally found my girlfriends g-spot turns out it was in her sister the whole time,0.36817184
239,18356,./data/img/18356.png,0,i took a shower this morning,0.16506039
240,52634,./data/img/52634.png,0,the secret to a successful marriage is to keep his stomach full and his balls empty,0.69309914
241,80512,./data/img/80512.png,1,"you can make jokes about anything, just not illegals that's crossing the border",0.48507857
242,62703,./data/img/62703.png,0,they shot the wrong gorilla,0.7670934
243,95176,./data/img/95176.png,0,notice how the kenyan skidmark has been silent about the mueller report?,0.19917677
244,27384,./data/img/27384.png,0,that face you make when you're a bully and just got beat up by a girl,0.8763936
245,82437,./data/img/82437.png,1,we should learn from ocean how to treat refugees,0.455726
246,26943,./data/img/26943.png,1,my incesters built this country!!!!,0.69542736
247,9152,./data/img/09152.png,0,"i don't have ex's. i have y's. like, ""y the hell did i date you?!?""",0.58486325
248,7429,./data/img/07429.png,1,i'm about to have my 5th abortion fuck you batman i'm the real crime fighter,0.96887034
249,75639,./data/img/75639.png,1,changing every single country it touches,0.15840589
250,46812,./data/img/46812.png,0,goat meat is very popular in islamic countries,0.68253016
251,63827,./data/img/63827.png,1,teacher of the year for black community,0.6003158
252,41276,./data/img/41276.png,1,evolution from peeling bananas to busting caps,0.071577646
253,56413,./data/img/56413.png,1,feeling cute might shoot a darkie later idk,0.9570354
254,69512,./data/img/69512.png,0,happy birthday you sexy beast,0.63743997
255,43175,./data/img/43175.png,1,when was the last time you saw so many mentally ill people on the streat,0.72561306
256,54129,./data/img/54129.png,0,dump pipe to the ocean,0.2703683
257,23645,./data/img/23645.png,1,what do they have in common? you enjoy pushing them down the stairs,0.7132176
258,89425,./data/img/89425.png,1,hello chocolate paradise princess i'm albert,0.09459684
259,16923,./data/img/16923.png,1,do you like goat anus? smell my finger,0.9491402
260,4769,./data/img/04769.png,1,"if she's pouting like this and you don't immediately drop the argument , motherfucker you gay",0.9923292
261,69815,./data/img/69815.png,0,thank you for allowing me into your country now we need to talk about the things that need to change around here to accommodate my beliefs,0.19766924
